,filename,transcription,filepath
1137,tef_05691_00303361039,దాంతో కథలో ముఖ్యమైన మార్పులు జరిగాయి,te_in_female\tef_05691_00303361039.wav
1138,tef_08664_01447507540,మీరు వ్రాసిన ప్రకాశం జిల్లా ప్రముఖుల జాబితాను చూశాను\n,te_in_female\tef_08664_01447507540.wav
1139,tef_04830_00534208920,అని ఎలుగెత్తి ప్రార్థించాడు,te_in_female\tef_04830_00534208920.wav
1140,tef_09935_01455368178,పావు మైలులో,te_in_female\tef_09935_01455368178.wav
1141,tef_06928_00863473227,ఈ రోజులలో సినిమా వ్యాపారానికి కూడా విజయవాడ ఒక కూడలి అని చెప్పవచ్చు,te_in_female\tef_06928_00863473227.wav
1142,tef_04830_01687254653,ఒక బస్సు గమనంలో ఉందని అనుకుందాం,te_in_female\tef_04830_01687254653.wav
1143,tef_07789_02022268838,ఇది వల్డ్ యూత్ డే అని తికమక పడరాదు,te_in_female\tef_07789_02022268838.wav
1144,tef_04213_00508283122,అమ్మవారి పేరు మాణిక్యాంబా దేవి,te_in_female\tef_04213_00508283122.wav
1145,tef_06566_00759656718,ఇక్కడ జిల్లా ప్రజా పరిషత్ ఉన్నత పాఠశాల ఉన్నది\n,te_in_female\tef_06566_00759656718.wav
1146,tef_06869_00645489094,వాడు నాకు అనుకూలుడు\n,te_in_female\tef_06869_00645489094.wav
1147,tef_05705_01186007605,కాని వీరి గురించిన ఆధారాలు చాలా తక్కువ,te_in_female\tef_05705_01186007605.wav
1148,tef_04261_00525085144,ఒక విఘడియ ఆరు రెప్పపాటులతో సమానం,te_in_female\tef_04261_00525085144.wav
1149,tef_03689_00851185309,అంతమాత్రాన గద్యకావ్యానికి హాని లేదు,te_in_female\tef_03689_00851185309.wav
1150,tef_07789_01960472563,కుండల్ ప్రముఖ యాత్రాకేంద్రంగా ఉంది,te_in_female\tef_07789_01960472563.wav
1151,tef_07789_01059143714,ఈమె చలసాని వీర రాఘవయ్య కుమార్తె,te_in_female\tef_07789_01059143714.wav
1152,tef_02828_01660644202,దయయో చుట్టాలవలే సాయపడును,te_in_female\tef_02828_01660644202.wav
1153,tef_05994_02089388830,పరిసరాలను శుభ్రంగా ఉంచుచున్నారు,te_in_female\tef_05994_02089388830.wav
1154,tef_06869_01510435322,ఇక్కడి భాష తెలుగు\n,te_in_female\tef_06869_01510435322.wav
1155,tef_06008_00533317703,వికీపీడియాలో వాడే బొమ్మలకు ప్రత్యేకంగా ఓ లైసెన్సు పద్ధతి ఉండొచ్చు,te_in_female\tef_06008_00533317703.wav
1156,tef_09935_01372083481,రెండు వందల గజాలలో,te_in_female\tef_09935_01372083481.wav
1157,tef_04213_00495334359,హేమవతి జలాశయం రిజర్వాయర్,te_in_female\tef_04213_00495334359.wav
1158,tef_05484_00252265285,ప్రాథమిక ఆరోగ్య కేంద్రం,te_in_female\tef_05484_00252265285.wav
1159,tef_09935_01014841923,ఇంటర్చేంజ్‌లోకి వెళ్ళండి,te_in_female\tef_09935_01014841923.wav
1160,tef_09935_02044865331,నావిగేషన్ పునఃప్రారంభించబడింది,te_in_female\tef_09935_02044865331.wav
1161,tef_05484_01385119283,కర్నూలు మరియు ప్రకాశం జిల్లాలు ఉత్తరాన సరిహద్దులు,te_in_female\tef_05484_01385119283.wav
1162,tef_08318_01618505618,ఆలయ ప్రాంగణం కొంత మంచుతో కప్పబడి ఉంటుంది,te_in_female\tef_08318_01618505618.wav
1163,tef_02828_01207236871,దీనిలో పాత బాక్టీరియా కూడా ఓ భాగంగా ఉన్నది,te_in_female\tef_02828_01207236871.wav
1164,tef_08664_01338689209,అతని ర్యాంకు కూడా వృద్ధి చెందుతుంది,te_in_female\tef_08664_01338689209.wav
1165,tef_06625_00584080420,అయితే లేఖిని ఉందని మాత్రం తెలుసు,te_in_female\tef_06625_00584080420.wav
1166,tef_04261_01178612372,లండన్ మరియు న్యూ యార్క్ రూట్ లెడ్జి,te_in_female\tef_04261_01178612372.wav
1167,tef_05691_01769847079,శ్రీ వీరాంజనేయ స్వామి ఆలయం,te_in_female\tef_05691_01769847079.wav
1168,tef_07789_00587746628,ఇక్కడ క్వారీలు ఉన్నాయి,te_in_female\tef_07789_00587746628.wav
1169,tef_05994_00458898995,పిన్ కోడ్ అయిదు లక్షలు ఎనిమిది వెలు రెండు వందలు రెండు,te_in_female\tef_05994_00458898995.wav
1170,tef_08318_00969125625,ఇవి పొంచి ఉండి వేటాడుతాయి,te_in_female\tef_08318_00969125625.wav
1171,tef_05181_00589052087,ఈ లింకు లో ఈ గ్రామ పంచాయితీ లేదు,te_in_female\tef_05181_00589052087.wav
1172,tef_01033_01016126733,నేలలో పొడుగుగా దుంపలు ఊరతాయి,te_in_female\tef_01033_01016126733.wav
1173,tef_09281_01707372545,భగవంతుని యందు అనన్యభక్తి గలిగియుండుట,te_in_female\tef_09281_01707372545.wav
1174,tef_05691_01082306354,ద్రవరూపంలోని మలినాలు తేమ వంటివి,te_in_female\tef_05691_01082306354.wav
1175,tef_05705_00571030109,ఇది కృష్ణానదికి ఉపనది,te_in_female\tef_05705_00571030109.wav
1176,tef_05705_00616639092,రెడ్డి తెలుగు సినిమా దర్శకుడు మరియు నిర్మాత,te_in_female\tef_05705_00616639092.wav
1177,tef_07789_00640085658,ఇది ప్రపంచవ్యాప్తంగా ఉపయోగించబడుతోంది,te_in_female\tef_07789_00640085658.wav
1178,tef_05181_01249363847,ఉరిశిక్షను జీవితఖైదుగా మార్చారు,te_in_female\tef_05181_01249363847.wav
1179,tef_09935_01684968942,దక్షిణం వైపుగా,te_in_female\tef_09935_01684968942.wav
1180,tef_03689_01249371947,దీనికి కారణం వీటి సాగు ఎక్కడా లేకపోవడమే,te_in_female\tef_03689_01249371947.wav
1181,tef_06869_01754314703,అంతర్జాలం మీద ఆంగ్లం ఆధిక్యత కలిగి ఉంది\n,te_in_female\tef_06869_01754314703.wav
1182,tef_05484_01887028831,రంగుల పట్టిక అయితే పేజీ కూడా అలాగే బాగుంటుంది,te_in_female\tef_05484_01887028831.wav
1183,tef_07789_01267428861,ఒక్కొక్కరే వారంతా అలసి పోయి తొలగి పోయారు,te_in_female\tef_07789_01267428861.wav
1184,tef_04213_00300489290,భక్తులు ఎన్నో లీలలను ఆయనకు ఆపాదించారు,te_in_female\tef_04213_00300489290.wav
1185,tef_03910_00766943697,ఇక్కడి భాష తెలుగు,te_in_female\tef_03910_00766943697.wav
1186,tef_04261_01168331532,ఇది మూడాశ్వాసాల ప్రబంధం,te_in_female\tef_04261_01168331532.wav
1187,tef_04213_01962255467,అందుకని కావాల్సినంతే వాడాలి,te_in_female\tef_04213_01962255467.wav
1188,tef_06625_01013711508,అజ్మీర్ పట్టణం జిల్లాకేంద్రంగా ఉంది,te_in_female\tef_06625_01013711508.wav
1189,tef_05484_01842943307,మణిహారం ఒక భాగండెబ్బై నాలుగు,te_in_female\tef_05484_01842943307.wav
1190,tef_04830_01752220503,రాకెట్లు స్వతహాగా అపాయకరమైనవి,te_in_female\tef_04830_01752220503.wav
1191,tef_04261_00333163035,నేను ఎవరినీ పొగడను తిట్టను,te_in_female\tef_04261_00333163035.wav
1192,tef_04261_01771475255,ఆ సైగను భీముడు గ్రహించాడు,te_in_female\tef_04261_01771475255.wav
1193,tef_01033_01785129820,ఓలేటి పార్వతీశం ఒక కవి\n,te_in_female\tef_01033_01785129820.wav
1194,tef_08318_00479518455,కృష్ణయ్య చేసిన ప్రయత్నం ఫలించలేదు,te_in_female\tef_08318_00479518455.wav
1195,tef_01908_00482491458,అన్న పదం సామాన్య శిక్షా గుర్తు,te_in_female\tef_01908_00482491458.wav
1196,tef_05181_01118136101,పెనుమర్తి విశ్వనాథశాస్త్రి టూకీగా పి\n,te_in_female\tef_05181_01118136101.wav
1197,tef_01908_00879498582,పాండవులు మంచి వాఋ కనుక సరి పోయింది,te_in_female\tef_01908_00879498582.wav
1198,tef_04830_01528063500,ఊరంతా ఈ కోలా హలంలో మునిగి పోతారు,te_in_female\tef_04830_01528063500.wav
1199,tef_05691_00553417510,చక్కెరను పరమితంగా వాడాలి,te_in_female\tef_05691_00553417510.wav
1200,tef_01908_01767881827,ఇది మండంలోని పెద్ద గ్రామాలలో ఒకటి,te_in_female\tef_01908_01767881827.wav
1201,tef_01908_02099838129,ఈ బుద్ధుని దేహము నీల రంగు,te_in_female\tef_01908_02099838129.wav
1202,tef_05994_01978071315,జ్ఞానంగల పులస్త్య మహర్షి యొక్క మనవడు,te_in_female\tef_05994_01978071315.wav
1203,tef_08318_00200825280,దీనిని ఒక మగమనిషి కోసం వ్యవహరిస్తారు,te_in_female\tef_08318_00200825280.wav
1204,tef_04261_00636089935,ఎప్పుడూ బిజీగా ఉంటాడు,te_in_female\tef_04261_00636089935.wav
1205,tef_05484_00999208944,మధ్యధరా ప్రాంతంచే చుట్టి వున్నది,te_in_female\tef_05484_00999208944.wav
1206,tef_05181_01417030642,ఇతను ఆఫ్ఘనిస్తాన్ పాకిస్తాన్ మరియు ఉత్తర భారత ప్రాంతాలను పాలించాడు\n,te_in_female\tef_05181_01417030642.wav
1207,tef_09281_01735139485,అవ్వ నలభై నాలుగు వాసవి నలభై అయిదు,te_in_female\tef_09281_01735139485.wav
1208,tef_03910_02033357643,పిన్ కోడ్ నంబర్,te_in_female\tef_03910_02033357643.wav
1209,tef_02828_00373457259,చంద్రగుప్తుడు వచ్చి హేళిని నోదార్చుట\n,te_in_female\tef_02828_00373457259.wav
1210,tef_05994_01110856961,వీటి అడుగు భాగం సమతలంగా ఉండేది,te_in_female\tef_05994_01110856961.wav
1211,tef_04213_00088622738,మద్రాసు నుండి వెలువడిన పత్రిక,te_in_female\tef_04213_00088622738.wav
1212,tef_01908_01951295932,తేలవేయు అనగా,te_in_female\tef_01908_01951295932.wav
1213,tef_05484_01029513697,తగు మాత్రం పండించు కునే వారు,te_in_female\tef_05484_01029513697.wav
1214,tef_04261_02008807127,దీనిని పదకొండువ శతాబ్దంలో చోళులు నిర్మించారు,te_in_female\tef_04261_02008807127.wav
1215,tef_05705_01074002932,ఆ బొమ్మను నొక్కి అసలు సైజు బొమ్మను చూడవచ్చు కూడా,te_in_female\tef_05705_01074002932.wav
1216,tef_08712_01768054518,ఈ పదాన్ని అనువదించటం కష్టం,te_in_female\tef_08712_01768054518.wav
1217,tef_06625_01943329801,భాగస్వాములు అనుకూలురై శ్రమిస్తారు,te_in_female\tef_06625_01943329801.wav
1218,tef_06566_00372999865,పిన్ కోడ్ అయిదు లక్షలు తొమ్మిది వేలు మూడు వందల ముప్పై తొమ్మిది,te_in_female\tef_06566_00372999865.wav
1219,tef_05691_01279728317,చట్టాలు దేశాలవారీగా మారుతుంటాయి,te_in_female\tef_05691_01279728317.wav
1220,tef_01033_01831690663,పురుషుల కన్నా స్త్రీల శాతం ఎక్కువ\n,te_in_female\tef_01033_01831690663.wav
1221,tef_08318_01155628576,పిన్ కోడ్ అయిదు వందలు ముప్పై నాలుగు వంద తొంభై తొమ్మిది,te_in_female\tef_08318_01155628576.wav
1222,tef_09935_00935897235,"వలయాకార కూడలిలో, రెండవ నిష్క్రమణ నుండి వెళ్ళండి",te_in_female\tef_09935_00935897235.wav
1223,tef_05994_00721824274,హైదరాబాద్ నగరం నుండి వంద యాభై కిలో మీటర్ల దూరంలో ఉంది,te_in_female\tef_05994_00721824274.wav
1224,tef_09935_01389090856,రౌండ్ ఎబౌట్ నుండి నిష్క్రమించండి,te_in_female\tef_09935_01389090856.wav
1225,tef_05181_01523927703,క్రమంగా తూర్పు చాళుక్యుల రాజ్యం దక్షిణాన నెల్లూరు నుండి ఉత్తరాన శ్రీకాకుళం వరకు విస్తరించింది,te_in_female\tef_05181_01523927703.wav
1226,tef_03689_02049385877,దాని వలన ప్రయోజనం శూన్యం,te_in_female\tef_03689_02049385877.wav
1227,tef_05994_01898971618,లాంటివి పదమూడుదాకా ఉన్నాయి,te_in_female\tef_05994_01898971618.wav
1228,tef_04830_01187608165,మొత్తము ఇరవై ఒకటి ఊపస్థంభాలు పాతబడ్డాయి,te_in_female\tef_04830_01187608165.wav
1229,tef_06008_01124454057,ఎత్తు ఉన్న పదమూడు శిఖరాలు ఉన్నాయి,te_in_female\tef_06008_01124454057.wav
1230,tef_04830_00914011632,జనం నోళ్లలో నానలేదు,te_in_female\tef_04830_00914011632.wav
1231,tef_05484_00126348945,డోలు మోతతోనే కథ ప్రారంభమవుతుంది,te_in_female\tef_05484_00126348945.wav
1232,tef_02828_00429210178,ఈ ఆలయ పునర్నిర్మాణానికి రు\n,te_in_female\tef_02828_00429210178.wav
1233,tef_08318_01516808314,అన్ని వసతులు గలవు,te_in_female\tef_08318_01516808314.wav
1234,tef_06008_01173747287,ఇది కాక మరో ఐదు విభాగాలు ఉన్నాయి,te_in_female\tef_06008_01173747287.wav
1235,tef_05994_02013505043,వీని యల్పకణిశములు జతలు తజలుగా నుండును,te_in_female\tef_05994_02013505043.wav
1236,tef_03689_00655851900,ఒక రోజుకు ఇరవై నాలుగు గంటలు లేదా అరవై ఘడియలు,te_in_female\tef_03689_00655851900.wav
1237,tef_05691_01410267522,సురేశ్ రెడ్డి విడుదల చేశారు,te_in_female\tef_05691_01410267522.wav
1238,tef_05705_01559942497,ఇది వరల్డ్ యూత్ డే అని తికమక పడరాదు,te_in_female\tef_05705_01559942497.wav
1239,tef_08318_00106120857,భావోద్వేగాలు అదుపులో ఉంటాయి,te_in_female\tef_08318_00106120857.wav
1240,tef_08318_00510661209,ఇది ఒక ఉపగ్రహ రేడియో స్టేషను,te_in_female\tef_08318_00510661209.wav
1241,tef_05181_01563279461,లోకవ్యక్తిని కావ్యవ్యక్తినయ్యాను,te_in_female\tef_05181_01563279461.wav
1242,tef_08712_00823107044,ఇప్పుడు నీవు చెప్పావు,te_in_female\tef_08712_00823107044.wav
1243,tef_05181_00853978334,ఎందుకు వికీ తెలుగు లో చేరింది వికీ తెలుగు లో తిరుమల పేజి చూసాను\n,te_in_female\tef_05181_00853978334.wav
1244,tef_03910_00654315857,సామాజిక శాస్త్రవేత్తలు పీటర్ ఎల్,te_in_female\tef_03910_00654315857.wav
1245,tef_09935_01495927290,కుడివైపులో నిష్క్రమించండి,te_in_female\tef_09935_01495927290.wav
1246,tef_03689_00840012060,పిన్ కోడ్ అయిదు లక్షల ఎనిమిది వేల మూడు వందల డెబ్బై ఆరు,te_in_female\tef_03689_00840012060.wav
1247,tef_06869_00273899332,దీనిని ఒక మగమనిషి కోసం వ్యవహరిస్తారు\n,te_in_female\tef_06869_00273899332.wav
1248,tef_03689_00237028410,అవి భారతీయ సినిమా ప్రాజెక్టు మరియు తెలుగు బాష ప్రాజెక్టు,te_in_female\tef_03689_00237028410.wav
1249,tef_05181_01695184380,పిన్ కోడ్ అయిదు వందలు ముప్పై నాలుగు వందలు ఇరవై ఆరు,te_in_female\tef_05181_01695184380.wav
1250,tef_01908_01278063810,ఈ నగరంలో మొత్తం ఇరవై అయిదు మ్యూజియంలు ఉన్నాయి,te_in_female\tef_01908_01278063810.wav
1251,tef_04261_00440279169,నీతి కథలు ఒకవ భాగం అరవై అయిదు,te_in_female\tef_04261_00440279169.wav
1252,tef_04830_01357449617,ఆయన కొన్ని పాటలకు సంగీతం కూడా సమకూర్చాడు,te_in_female\tef_04830_01357449617.wav
1253,tef_03689_01565073184,ఇది ఘంటసాల నిర్మించిన తొలిచిత్రం,te_in_female\tef_03689_01565073184.wav
1254,tef_05691_00532528637,సంగ్రహించిన తేదీ రెండు కోటులు లక్ష తొమ్మిది వందలు పన్నెండు,te_in_female\tef_05691_00532528637.wav
1255,tef_03910_02140897755,కానీ నేను న్యూ జెర్సీ నుండి వచ్చాను,te_in_female\tef_03910_02140897755.wav
1256,tef_09935_00782305870,ఉత్తరం వైపుగా,te_in_female\tef_09935_00782305870.wav
1257,tef_05994_00458431080,ఒక ప్రాథమిక పాఠశాల కలదు,te_in_female\tef_05994_00458431080.wav
1258,tef_04213_01968994921,ఈ విషయాలపై నిర్వాహకులకు ప్రత్యేకమైన పాత్ర లేదు,te_in_female\tef_04213_01968994921.wav
1259,tef_09281_00880869910,పాలించి సుఖమును పొందుము,te_in_female\tef_09281_00880869910.wav
1260,tef_04261_01095520834,జాతీయ నాయకులెందరో చూచి ఆనందించారు,te_in_female\tef_04261_01095520834.wav
1261,tef_04213_01185040719,ఆయన ప్రధాన కార్యాలయం చత్రాలో ఉంది,te_in_female\tef_04213_01185040719.wav
1262,tef_03689_01793919543,చాలావరకు పవిత్ర గ్రంథాలు సంస్కృతం లోనే ఉన్నాయి,te_in_female\tef_03689_01793919543.wav
1263,tef_06928_02047243219,మన రాష్ట్రంలోని విజయవాడ ఒక మంచి ఉదాహరణ,te_in_female\tef_06928_02047243219.wav
1264,tef_05691_01509272068,జనసంచారం ఉన్న ప్రాంతాలలో వ్యభిచారం నేరం,te_in_female\tef_05691_01509272068.wav
1265,tef_08318_01996455164,కానీ నిస్సంశయముగా వారికి సమకాలీనుడు,te_in_female\tef_08318_01996455164.wav
1266,tef_09935_00576206765,మీ గమ్యస్థానం కుడివైపున ఉంటుంది.,te_in_female\tef_09935_00576206765.wav
1267,tef_05181_00578451620,చేపల కోసం గాలిస్తాడు\n,te_in_female\tef_05181_00578451620.wav
1268,tef_03910_01711154888,ఉదాహరణకు అల్లూరి సీతారామ రాజు సినిమా,te_in_female\tef_03910_01711154888.wav
1269,tef_03910_00253425913,ఘంటసాల ఆంధ్ర ప్రదేశ్ రాష్ట్రములోని కృష్ణా జిల్లాకు చెందిన ఒక మండలము,te_in_female\tef_03910_00253425913.wav
1270,tef_03910_01939273231,నాఫ్స్ అమ్మారహ్ వెయ్యి రెండు వందల యాభై మూడు,te_in_female\tef_03910_01939273231.wav
1271,tef_08712_00896977636,హైదరాబాదు నుండి వంద తొంభై రెండు కిమీ,te_in_female\tef_08712_00896977636.wav
1272,tef_05181_00019617673,ఈ ప్రమాదం జరిగిన కొన్ని నెలల తర్వాత దీన్ని గురించి కొన్ని మూల గ్రంథాలు కూడా రాయడం జరిగింది,te_in_female\tef_05181_00019617673.wav
1273,tef_06625_00803237861,ఇతర పెరుగుల కంటే దీనికి వగరు తక్కువ,te_in_female\tef_06625_00803237861.wav
1274,tef_04830_00821079752,అందుకు పలు వైవిద్యమైన కారణాలు ఉన్నాయి,te_in_female\tef_04830_00821079752.wav
1275,tef_05691_01831579121,వీరికి ఒక సోదరి ఉంది,te_in_female\tef_05691_01831579121.wav
1276,tef_08318_00959004830,తన ద్వారపాలకునిగా నియమించుకున్నాడు,te_in_female\tef_08318_00959004830.wav
1277,tef_04261_01521595691,ముందుగా ద్రౌపదికి యోగసమాధి సడలింది,te_in_female\tef_04261_01521595691.wav
1278,tef_04830_01557157155,మరియు ఇంజనీరింగ్ కళాశాల కూడా కలదు,te_in_female\tef_04830_01557157155.wav
1279,tef_01908_00687530095,ఇదే పేరుతో మరి కొన్ని గ్రామాలున్నాయి,te_in_female\tef_01908_00687530095.wav
1280,tef_08318_01392387696,దానికి ముందు ఒక విభిన్నమైన విధానం ఉండేది,te_in_female\tef_08318_01392387696.wav
1281,tef_09935_01167352684,మూడు కిలోమీటర్లలో,te_in_female\tef_09935_01167352684.wav
1282,tef_03689_00425158722,సంగ్రహించిన తేదీ పదహారు రెండు వేల ఎనిమిది,te_in_female\tef_03689_00425158722.wav
1283,tef_09281_00925106575,ఒకో అక్షరానికి ఒకో పేజీ కేటాయించబడింది,te_in_female\tef_09281_00925106575.wav
1284,tef_04830_00761030051,ఈ శాస్త్రీయ ఆలోచనలు ఆయనకు ఎక్కడ వచ్చాయి,te_in_female\tef_04830_00761030051.wav
1285,tef_06625_00297840031,వీటిలో పట్నం పట్టణానికి రూపాంతరం,te_in_female\tef_06625_00297840031.wav
1286,tef_05705_01264432088,నాకు రుచికరంగా వంటలు చేయడం వచ్చు కదా,te_in_female\tef_05705_01264432088.wav
1287,tef_06869_00527169324,పంతుల తెలుగువారిలో కొందరి ఇంటిపేరు\n,te_in_female\tef_06869_00527169324.wav
1288,tef_08318_01523901072,సాలీనా దీని ఉత్పాదన ఇరవై టన్నులకి మించదు,te_in_female\tef_08318_01523901072.wav
1289,tef_05691_00132407423,విజేత జట్టుకు దీని నకలు ఇవ్వబడుతుంది,te_in_female\tef_05691_00132407423.wav
1290,tef_05994_00603560366,కడప జిల్లాశాంతకుమారి అలనాటి నటి,te_in_female\tef_05994_00603560366.wav
1291,tef_05181_01351170611,సుశీల అమ్మగారు జబ్బు మనిషి\n,te_in_female\tef_05181_01351170611.wav
1292,tef_05484_00992480110,విశాఖపట్నం ఆంధ్ర ప్రదేశ్ రాష్ట్రములోని విశాఖపట్నం జిల్లాకు చెందిన ఒక మండలము,te_in_female\tef_05484_00992480110.wav
1293,tef_09281_01155286268,అది విని వశిష్ఠుడు అతనిని వారించాడు,te_in_female\tef_09281_01155286268.wav
