,filename,transcription,filepath
27,tef_05691_02058763596,ఈ గ్రామానికి సిటి బస్సుల సౌకర్యం ఉంది,te_in_female\tef_05691_02058763596.wav
28,tef_05705_00960906212,అయితే ఎండకు ఆ పసరు మంచులో కరిగిపోయింది,te_in_female\tef_05705_00960906212.wav
29,tef_08664_01995689451,పుట్టింది నరసాపురం పశ్చిమ గోదావరి జిల్లా\n,te_in_female\tef_08664_01995689451.wav
30,tef_04830_00543058645,ఈ కమిటీ యందు ఇరవై ఒకటి రాష్ట్ర పార్టీలుంటాయి,te_in_female\tef_04830_00543058645.wav
31,tef_07789_00502995418,హైదరాబాదు నుండి వందా తొంభై రెండు కిలోమీటర్లు,te_in_female\tef_07789_00502995418.wav
32,tef_03689_01191980689,మండల పరిషత్తు ప్రాథమిక పాఠశాల,te_in_female\tef_03689_01191980689.wav
33,tef_05994_00931522307,అందువలన వెన్నపండు అని అనడం కద్దు,te_in_female\tef_05994_00931522307.wav
34,tef_02828_00581441672,సమస్త భూతములకు ఆత్మ విష్ణువే\n,te_in_female\tef_02828_00581441672.wav
35,tef_06928_01219375780,ఈ సమయంలో దాసరి నారాయణరావు కె.రాఘవేంద్రరావు కోడిరామి రెడ్డి అగ్రస్థానంలో ఉన్న దర్శకులు,te_in_female\tef_06928_01219375780.wav
36,tef_09281_01646306434,మలనిర్హరణ సమయంలో ముక్కాల్సిన అవసరం రాదు,te_in_female\tef_09281_01646306434.wav
37,tef_06625_00013009882,ఈ కాలంలో నాలుగు సినిమాలలో నటించాడు కూడా,te_in_female\tef_06625_00013009882.wav
38,tef_04261_01348107187,ఇది కొల్లంలోని టౌన్ ప్రాంతంలో ఉంది,te_in_female\tef_04261_01348107187.wav
39,tef_06625_01916583686,ఇది భారత సైన్యం యొక్క యుద్ధపతాకం కూడా,te_in_female\tef_06625_01916583686.wav
40,tef_08318_00817086636,వడాలి ఒక చిన్న గ్రామము,te_in_female\tef_08318_00817086636.wav
41,tef_01908_01035773578,ప్రిన్సిపాల్ ఒక మొమెంటోతో ప్రశంసించారు,te_in_female\tef_01908_01035773578.wav
42,tef_05994_01779241029,పిన్ కోడ్ అయిదు లక్షలు పదునయిదు వేల అయిదు వందలు ఎనభై ఒకటి,te_in_female\tef_05994_01779241029.wav
43,tef_04213_00748557285,సాధారణ బీమా యునైటెడ్ ఇండియా,te_in_female\tef_04213_00748557285.wav
44,tef_04213_01419097691,కిషన్ పట్నాయక్ సాంఘిక నాయకుడు,te_in_female\tef_04213_01419097691.wav
45,tef_06625_01124758406,రక్తము తీయు,te_in_female\tef_06625_01124758406.wav
46,tef_08318_01627528003,వశిష్టపుత్ర శాతకర్ణి పా,te_in_female\tef_08318_01627528003.wav
47,tef_03910_01021539248,ఆమె జూలై పదహారు రెండు వేల తొమ్మిది న సహజంగా మరణించింది,te_in_female\tef_03910_01021539248.wav
48,tef_06869_01125893542,ఇది ఒక భౌగోళిక అద్భుతమని భావిస్తున్నారు\n,te_in_female\tef_06869_01125893542.wav
49,tef_01908_00983117739,ఇది ఒక భౌగోళిక అద్భుతమని భావిస్తున్నారు,te_in_female\tef_01908_00983117739.wav
50,tef_08712_01794832634,దీనిలో అనేక విశేషాలు ఉన్నాయి,te_in_female\tef_08712_01794832634.wav
51,tef_09935_00564653403,దయచేసి సమస్యను వివరించండి,te_in_female\tef_09935_00564653403.wav
52,tef_04213_01673695297,శుకుడు తండ్రికి నమస్కరించి బయలుదేరాడు,te_in_female\tef_04213_01673695297.wav
53,tef_06928_00629715781,ఆ తరువాత ప్రపంచ సీరీస్ క్రికెట్‌లో ప్రవేశించి అక్కడ ప్రధాన పాత్ర వహించాడు,te_in_female\tef_06928_00629715781.wav
54,tef_06625_00548627153,దీని ముందు డిడిటి చేసే హాని చాలా తక్కువ,te_in_female\tef_06625_00548627153.wav
55,tef_09281_00087584168,సినీ సంగీతం దునియా పూర్తిగా విచిత్రమైంది,te_in_female\tef_09281_00087584168.wav
56,tef_01908_01071647765,ఇది ఒక గుడిసెలు లేని గ్రామం,te_in_female\tef_01908_01071647765.wav
57,tef_01908_00214467241,కూడా చూడండి  న్యూస్,te_in_female\tef_01908_00214467241.wav
58,tef_06008_01631974372,అక్కడ మొదటి సంవత్సరం బిటెక్,te_in_female\tef_06008_01631974372.wav
59,tef_06928_00806602234,విశ్వా గారు మీరు అప్లోడ్ చేసిన బొమ్మ చూసాను,te_in_female\tef_06928_00806602234.wav
60,tef_04830_00359456151,రాశికార్బనిర్లాశి ఆ వరసలో రావాలి,te_in_female\tef_04830_00359456151.wav
61,tef_07789_01566064373,ద హూ  లైవ్ ఎట్ లీడ్స్,te_in_female\tef_07789_01566064373.wav
62,tef_05705_00377114098,ఇండియా ఎ హిస్టరీ,te_in_female\tef_05705_00377114098.wav
63,tef_06928_01836764500,కాని ఆయన పాశ్చాత్య సాహిత్యం పట్ల గౌరవం కలిగి ఉండేవాడు,te_in_female\tef_06928_01836764500.wav
64,tef_01908_00228606924,అని కబురు చేసేవారు,te_in_female\tef_01908_00228606924.wav
65,tef_09935_01038244981,యాభై మీటర్లలో,te_in_female\tef_09935_01038244981.wav
66,tef_03910_01075228875,ఈ గ్రామం మండలంలోనే అతి పెద్ద గ్రామం,te_in_female\tef_03910_01075228875.wav
67,tef_06008_00744024172,మళ్ళీ పరిశీలించి మీ అభిప్రాయం వ్రాయండి,te_in_female\tef_06008_00744024172.wav
68,tef_03910_00474541452,గర్భగుడి మాత్రమే ఆ కాలానికి చెందినది,te_in_female\tef_03910_00474541452.wav
69,tef_09281_01751360099,వీటన్నిటి గురించి తరువాత నేర్చుకుందాం,te_in_female\tef_09281_01751360099.wav
70,tef_01908_00995370969,దాన్ని మనమిప్పుడు కార్ల అంటున్నాము,te_in_female\tef_01908_00995370969.wav
71,tef_04261_00921762395,దీని పువ్వులు ఓష్టకారముగ లేవు,te_in_female\tef_04261_00921762395.wav
72,tef_05691_00547757237,ఆత్మద్వారా అతడు నిజమైన బలాన్ని పొందుతాడు,te_in_female\tef_05691_00547757237.wav
73,tef_01908_01406950847,తిరువన్నమలై పంచ భూత క్షేత్రాలలో ఒకటి,te_in_female\tef_01908_01406950847.wav
74,tef_06869_00523601927,ఆ అధికారి ప్రాంతీయ ప్రభుత్వానికి అధినేత\n,te_in_female\tef_06869_00523601927.wav
75,tef_03689_01340457664,వీటినుండి చిప్సు కూడా తయారు చేస్తారు,te_in_female\tef_03689_01340457664.wav
76,tef_06869_00718414853,ఈ కార్యక్రమాలన్నీ మంచి ఫలితాలను ఇచ్చాయి\n,te_in_female\tef_06869_00718414853.wav
77,tef_05705_01145709143,ఇందులో డెబ్బై అయిదు పర్సెంట్ కార్బో హైడ్రేట్లు ఉన్నాయి,te_in_female\tef_05705_01145709143.wav
78,tef_05994_00143664459,ఆ మహాదేవిని ఈశ్వరమ్మ అని పిలుచుకోవాలి,te_in_female\tef_05994_00143664459.wav
79,tef_01908_00831793530,తద్వారా జరిగే పరిణామాలూ థ్రెడ్ చెప్పారు,te_in_female\tef_01908_00831793530.wav
80,tef_01908_00982369047,రుచి కూడా వికారం పుట్తించునట్లుండును,te_in_female\tef_01908_00982369047.wav
81,tef_04830_01326876925,జయరాజు సింగరేణిపోరాటాలకు సరైన మోగిండు,te_in_female\tef_04830_01326876925.wav
82,tef_04261_00480494282,వెంసూరు మందల కేంద్రానికి ఏడు కిమీ,te_in_female\tef_04261_00480494282.wav
83,tef_06566_00308875287,దాదాసాహెబ్ ఫాల్కే అవార్డు పొందిన తొలి దక్షిణ భారతీయుడు\n,te_in_female\tef_06566_00308875287.wav
84,tef_06008_01862920180,ఎందుకు వికీ తెలుగు లో చేరింది వికీ తెలుగులో తిరుమల పేజి చూసాను,te_in_female\tef_06008_01862920180.wav
85,tef_06869_00204725132,వ్యవసాయం మూలంగా నీటి లోతు తగ్గిపోయింది\n,te_in_female\tef_06869_00204725132.wav
86,tef_04213_01623873036,ఈ శంఖానాదాన్ని శుభ సూచకంగా భావిస్తారు,te_in_female\tef_04213_01623873036.wav
87,tef_08712_01566260343,నీవు నేను సనాతులమైన నరనారాయణులము,te_in_female\tef_08712_01566260343.wav
88,tef_06625_01904070202,ప్రభుత్వం తలపెట్టిన ఎన్టిఆర్,te_in_female\tef_06625_01904070202.wav
89,tef_05994_00550699651,ఆ సైగను భీముడు గ్రహించాడు,te_in_female\tef_05994_00550699651.wav
90,tef_06625_01521168372,మరియు హెలెన్ పోలాటాస్కో,te_in_female\tef_06625_01521168372.wav
91,tef_04261_02067115435,వృత్తి రీత్యా తిరుపతి ఎస్వి,te_in_female\tef_04261_02067115435.wav
92,tef_06928_00862600646,తెలుగు ఉర్దూ హిందీ ఎక్కువగా మాట్లాడే భాషలు,te_in_female\tef_06928_00862600646.wav
93,tef_04830_01111793893,దాంతో కథలో ముఖ్యమైన మార్పులు జరిగాయి,te_in_female\tef_04830_01111793893.wav
94,tef_01908_01312743194,ఆగష్టు ఇరవై తొమ్మిది జాతీయ క్రీడా దినోత్సవము,te_in_female\tef_01908_01312743194.wav
95,tef_05994_01371060237,వీడు బ్రాహ్మణుడు కాదు,te_in_female\tef_05994_01371060237.wav
96,tef_08318_01574257948,మిగతా భాగం సారంగపాణిది,te_in_female\tef_08318_01574257948.wav
97,tef_05994_00288834654,మగ పువ్వుల కంకి మిక్కిలి చిన్నది,te_in_female\tef_05994_00288834654.wav
98,tef_08664_00860133764,ఈనడానికి పదునయిదు నుండి ముప్పై నిమిషాలు పడుతుంది,te_in_female\tef_08664_00860133764.wav
99,tef_01908_00666727084,దేవరకొండ కోట ఇది దేవరకొండ పట్టణంలోని కోట,te_in_female\tef_01908_00666727084.wav
100,tef_01908_00108679767,అమెరికన్ ఆస్టియోపాథిక్ అసోసియేషన్,te_in_female\tef_01908_00108679767.wav
101,tef_09935_01144696590,అయిదు వందల అడుగుల్లో,te_in_female\tef_09935_01144696590.wav
102,tef_01033_02004214058,అల్లు అర్జున్ మొదటి చిత్రం కె\n,te_in_female\tef_01033_02004214058.wav
103,tef_06625_02081463069,చంపాటి చెంపాటి ఇరవై ఏడు,te_in_female\tef_06625_02081463069.wav
104,tef_08318_00728019228,ఈ గ్రామము ఆత్మకూరు నుండి ఎనిమిది కిలోమీటర్లు,te_in_female\tef_08318_00728019228.wav
105,tef_04213_00288519189,బౌద్ధులకు ఒక ప్రాముఖ్యమైన యాత్రాక్షేత్రం,te_in_female\tef_04213_00288519189.wav
106,tef_08318_00193441635,టీకాల మందులు దీనికి ఒక ఉదాహరణ,te_in_female\tef_08318_00193441635.wav
107,tef_05691_00024541938,కథలుగాథలు ఒక,te_in_female\tef_05691_00024541938.wav
108,tef_09281_00558507199,జిల్లా దాదాపు త్రిభుజాకారంలో ఉంటుంది,te_in_female\tef_09281_00558507199.wav
109,tef_05484_00914189263,సమస్త భూతములకు ఆత్మ విష్ణువే,te_in_female\tef_05484_00914189263.wav
110,tef_05181_00122483058,పాంపీ కళ హాలీవుడ్ కళ వంటిది కాదు\n,te_in_female\tef_05181_00122483058.wav
111,tef_05691_00809474912,చీలమండ  కాలు చివరి భాగము,te_in_female\tef_05691_00809474912.wav
112,tef_04261_00949123703,మే ఇరవై ఒకటి  జాతీయ ఉగ్రవాద వ్యతిరేక దినోత్సవము,te_in_female\tef_04261_00949123703.wav
113,tef_08712_00181442568,సైంధవుడు రూపు మాసి పోయాడు,te_in_female\tef_08712_00181442568.wav
114,tef_06566_01774398216,మళ్ళీ పరిశీలించి మీ అభిప్రాయం వ్రాయండి\n,te_in_female\tef_06566_01774398216.wav
115,tef_06008_02115550767,దేవా గారి చర్చ పేజీలో ఉన్నది,te_in_female\tef_06008_02115550767.wav
116,tef_06625_00011575821,హదీసులలో సంపూర్ణంగా వివరింపబడింది,te_in_female\tef_06625_00011575821.wav
117,tef_06928_00630236356,దాని కోసం చాలా సాధన చేసేవాడు,te_in_female\tef_06928_00630236356.wav
118,tef_08318_00718472585,బనర్సి గాకేశ్తో ముకర్జీ,te_in_female\tef_08318_00718472585.wav
119,tef_04261_01843530519,ఈ నవలలో కథానాయకుని పాత్ర పేరు షాడో,te_in_female\tef_04261_01843530519.wav
120,tef_08318_00836751872,చివరకు ఏడుగురిని ఎన్నిక చేసుకొన్నాడు,te_in_female\tef_08318_00836751872.wav
121,tef_03689_01615039569,అల్లు అర్జున్ మొదటి చిత్రం కె,te_in_female\tef_03689_01615039569.wav
122,tef_08664_01703356466,వింధ్యపర్వతము వారి యింటిదేవత\n,te_in_female\tef_08664_01703356466.wav
123,tef_05994_00771698496,గ్రంథాలయ సర్వస్వము ఏడు,te_in_female\tef_05994_00771698496.wav
124,tef_05181_00449274169,ఈ దుంప మార్పు చెందిన కొమ్మ\n,te_in_female\tef_05181_00449274169.wav
125,tef_05691_02052005112,బ్రౌన్ నిఘంటువు ప్రకారం రుచి పదప్రయోగాలు,te_in_female\tef_05691_02052005112.wav
126,tef_07789_01233590134,తినడం తప్ప పని చేయడని అర్థం,te_in_female\tef_07789_01233590134.wav
127,tef_09281_01715104648,ఆమ్లత అసిడిటీ ను తగ్గిస్తుంది,te_in_female\tef_09281_01715104648.wav
128,tef_09281_01242465606,కవిత్వం కూడ రాశారు,te_in_female\tef_09281_01242465606.wav
129,tef_03910_00330150825,పంచకోణయుతమైన ధృఢమైన టెంక గల ఫలాలు,te_in_female\tef_03910_00330150825.wav
130,tef_08318_01850723120,ఇది నగరానికి పడమటి వైపున ఉంది,te_in_female\tef_08318_01850723120.wav
131,tef_06928_01307542254,ఏనుగు ఇంటి పేరు తెలుగువారిలో కొందరి ఇంటి పేరు,te_in_female\tef_06928_01307542254.wav
132,tef_06625_01982428774,ఆత్మద్వారా అతడు నిజమైన బలాన్ని పొందుతాడు,te_in_female\tef_06625_01982428774.wav
133,tef_05691_00763273661,అతడి లక్షణములు ఇంద్రియములకు గోచరించవు,te_in_female\tef_05691_00763273661.wav
134,tef_03689_01266905117,ది ద్యబ్బుక్,te_in_female\tef_03689_01266905117.wav
135,tef_05691_00229094491,నల్లేరు తీగ చూర్ణం రెండు భాగాలు గ్రహించాలి,te_in_female\tef_05691_00229094491.wav
136,tef_06625_00331433992,వెబ్ సైట్ గా ప్రశంసలు,te_in_female\tef_06625_00331433992.wav
137,tef_06008_00868544543,ఇది సహజంగా సుల్తానులకు లభించింది,te_in_female\tef_06008_00868544543.wav
138,tef_06625_00964019270,ఇది తిరునాంగూర్ దివ్యదేశముల లోనిది,te_in_female\tef_06625_00964019270.wav
139,tef_06625_00332893079,ఇది ఒకప్పటి భారతీయ పద్ధతి,te_in_female\tef_06625_00332893079.wav
140,tef_04213_00273807729,ఆమెది కన్నీళ్లమయమైన బాల్యం,te_in_female\tef_04213_00273807729.wav
141,tef_03689_00595076058,సోనియా స్వయంగా అంగీకరించిన ప్రకారం,te_in_female\tef_03689_00595076058.wav
142,tef_01908_01563896590,అతడు పైనుండి నడిపేవాడు,te_in_female\tef_01908_01563896590.wav
143,tef_05691_01222318820,నీతి కథలు ఒకటవ భాగం అరవై అయిదు,te_in_female\tef_05691_01222318820.wav
144,tef_05181_02058498559,ఈకోటలో అనేక సినిమాలను చిత్రీకరించారు,te_in_female\tef_05181_02058498559.wav
145,tef_08318_00598483792,చెరువు కట్ట మీద పోలేరమ్మ గుడి ఉన్నది,te_in_female\tef_08318_00598483792.wav
146,tef_05691_00478142834,కానీ వాటిపైకి నా మనసు పోలేదు,te_in_female\tef_05691_00478142834.wav
147,tef_05994_00943423330,మన దేశానికి వచ్చినప్పుడు,te_in_female\tef_05994_00943423330.wav
148,tef_06566_01386245463,గ్రామ విస్తీర్ణం తొమ్మిది వందల నలభై హెక్టారులు\n,te_in_female\tef_06566_01386245463.wav
149,tef_06625_00364964643,వక్రత భావ సంభంధమైనది,te_in_female\tef_06625_00364964643.wav
150,tef_05994_00703803511,ఈమె ఎక్కువగా ఆధిపత్యం చెలాయిస్తుంటుంది,te_in_female\tef_05994_00703803511.wav
151,tef_02828_00667187597,రాయ్ నృత్యం ప్రాబల్యంలో ఉంది\n,te_in_female\tef_02828_00667187597.wav
152,tef_08318_01481026938,నీతికి పునాది మానవ స్వభావంలోనే ఉంటుంది,te_in_female\tef_08318_01481026938.wav
153,tef_05994_00585319412,అతడు విజయవంతమైన సేనానాయకుడు,te_in_female\tef_05994_00585319412.wav
154,tef_05705_00911398532,ఇది విండో నిర్వాహకాన్ని వినియోగిస్తుంది,te_in_female\tef_05705_00911398532.wav
155,tef_03689_01359246843,వాడు నాకు అనుకూలుడు,te_in_female\tef_03689_01359246843.wav
156,tef_05691_01736013373,దిగువ ఒకే ఉదాహరణ ఇవ్వబడింది,te_in_female\tef_05691_01736013373.wav
157,tef_04213_01748189897,ఆయన కొన్ని పాటలకు సంగీతం కూడా సమకూర్చాడు,te_in_female\tef_04213_01748189897.wav
158,tef_08664_01136678632,ఇదే పేరుతో ఉన్న ఇతర ప్రాంతాల కొరకు వడ్డేపల్లి అయోమయ నివృత్తి చూడండి\n,te_in_female\tef_08664_01136678632.wav
159,tef_03689_00848745980,మొత్తము ఇరవై ఒకటి ఊపస్థంభాలు పాతబడ్డాయి,te_in_female\tef_03689_00848745980.wav
160,tef_05994_01661908485,జయరాజు సింగరేణిపోరాటాలకు సైరనై మోగిండు,te_in_female\tef_05994_01661908485.wav
161,tef_03910_01279910270,ఎందుకంటే ఏనుగు అనే జంతువు గురించిన వ్యాసం తెలుగు వికీలో ఉంది,te_in_female\tef_03910_01279910270.wav
162,tef_05691_00296069034,ఇవి నిర్లక్ష్యానికి గురవుతున్నాయి,te_in_female\tef_05691_00296069034.wav
163,tef_05691_02086211222,ముందు అగస్త్య్ని భుజించమని చెప్పాడు,te_in_female\tef_05691_02086211222.wav
164,tef_03689_00215028566,ఇవి ప్రమాదాన్ని సూచించటానికి వాడబడతాయి,te_in_female\tef_03689_00215028566.wav
165,tef_03910_00723834101,ఎం_letter బీ_letter ఏ_letter కూడా అక్కడే చదివాడు,te_in_female\tef_03910_00723834101.wav
166,tef_03689_01473264202,ప్రారంభ రోమన్ సైన్యం,te_in_female\tef_03689_01473264202.wav
167,tef_05994_01665501852,కోకిల లేదా కోయిల ఆంగ్లం  ఒక పక్షి,te_in_female\tef_05994_01665501852.wav
168,tef_07789_00814898156,ఇతని తండ్రి పేరు చుక్కపల్లి తిరుమలయ్య,te_in_female\tef_07789_00814898156.wav
169,tef_04830_01933037744,బెన్ నస్రల్లా రెండు వేల ఏడుకె,te_in_female\tef_04830_01933037744.wav
170,tef_05181_01088745253,ఇవి తాపేశ్వరం మడత కాజాల వంటి కాజాలు కావు,te_in_female\tef_05181_01088745253.wav
171,tef_06625_00554083427,వెంటనే తేరుకొని తప్పించుకున్నాడు,te_in_female\tef_06625_00554083427.wav
172,tef_09281_01643079085,ఆర్య అంటే గొప్ప వంశస్థుడు అని అర్ధం,te_in_female\tef_09281_01643079085.wav
173,tef_08664_00163034459,మాయాబజార్ చిత్రంతో మొదలుపెట్టి చాలా చిత్రాలలో కెవి రెడ్డి చేతికింద పనిచేశాడు,te_in_female\tef_08664_00163034459.wav
174,tef_04830_00488773746,గ్రహాల సంఖ్య మూడు వందల ఎనభై తొమ్మిది,te_in_female\tef_04830_00488773746.wav
175,tef_05705_00455298094,పుట్టింది నరసాపురం పశ్చిమ గోదావరి జిల్లా,te_in_female\tef_05705_00455298094.wav
176,tef_05705_01317072296,ఒకసారి మంగళూరు కన్నడ పేరు గమనించండి,te_in_female\tef_05705_01317072296.wav
177,tef_08318_00318170522,ధ్యానం చేసేటప్పుడు ప్రశాంతతను ఇస్తుంది,te_in_female\tef_08318_00318170522.wav
178,tef_03689_01446632147,అందులో అరవై మూడు మరియు అరవై అయిదు ఐసోటోపులు స్థిరమైనవి,te_in_female\tef_03689_01446632147.wav
179,tef_06008_01618354793,కడప ఆంధ్ర ప్రదేశ్ రాష్ట్రములోని కడప జిల్లాకు చెందిన ఒక మండలము,te_in_female\tef_06008_01618354793.wav
180,tef_05691_02049416798,చోరగణ తిలకము,te_in_female\tef_05691_02049416798.wav
181,tef_05691_00806300275,జాస్ బీహార్ గిరిజనుల రాజు,te_in_female\tef_05691_00806300275.wav
182,tef_09281_00800790597,అందువలననే వీటిని బుట్టబొమ్మలంటారు,te_in_female\tef_09281_00800790597.wav
183,tef_05691_01547031168,అయిదు కప్పులు నీళ్లు పట్టే గిన్నె తీసుకో,te_in_female\tef_05691_01547031168.wav
184,tef_08664_01651227751,గ్రామంలో ప్రధాన పంటలు వరి పత్తి మిరప కూరగాయలు,te_in_female\tef_08664_01651227751.wav
185,tef_06008_01534383657,ఫీరోజి సరిగా అరవై సంవత్సరాలు జీవించారు,te_in_female\tef_06008_01534383657.wav
