,filename,transcription,filepath
1096,tem_08680_01270591275,ఈ ప్రమాదం జరిగిన కొన్ని నెలల తర్వాత దీన్ని గురించి కొన్ని మూల గ్రంథాలు కూడా రాయడం జరిగింది,end_to_end\tem_08680_01270591275.wav
1097,tem_00974_01567287381,ఇందులో వంద రూపాయిలు పెట్టుబడిగా పోతుంది,end_to_end\tem_00974_01567287381.wav
1098,tem_00682_01124175473,తెలుగు సినిమా ప్రాజెక్టు నిర్మాణంలో ఉన్న బొమ్మ,end_to_end\tem_00682_01124175473.wav
1099,tem_02769_01786297256,వీరికి ఒక కుమారుడు మరియు ఒక కుమార్తె,end_to_end\tem_02769_01786297256.wav
1100,tem_09015_01209320113,ఈ ఉపయోగాలు వివాదస్పదంగా ఉన్నాయి,end_to_end\tem_09015_01209320113.wav
1101,tem_03338_01778390756,ఆదిలాబాదు నుండి నలభై ఏడు కిలోమీటర్ల దూరంలో ఉంది,end_to_end\tem_03338_01778390756.wav
1102,tem_08680_01606234167,ఇక్కడ జిల్లా ప్రజా పరిషత్ ఉన్నత పాఠశాల ఉన్నది\n,end_to_end\tem_08680_01606234167.wav
1103,tem_09222_01703046950,మొయినాబాద్‌ ఆంధ్రప్రదేశ్ రాష్ట్రములోని రంగారెడ్డి జిల్లాకు చెందిన ఒక మండలం,end_to_end\tem_09222_01703046950.wav
1104,tem_08377_00606471153,సూర్యగ్రహణమునకు సూర్యుని గ్రహించుట\n,end_to_end\tem_08377_00606471153.wav
1105,tem_00682_01000111462,స్పష్టతతో గూడినది వివరించాడు,end_to_end\tem_00682_01000111462.wav
1106,tem_03338_00368896747,కిప్సన్ అండ్ చిట్వుడ్,end_to_end\tem_03338_00368896747.wav
1107,tem_02769_01248688961,ఇదంతా ఒకప్పటి సంగతి,end_to_end\tem_02769_01248688961.wav
1108,tem_06359_00054733629,వారికి నాలుగురు పిల్లలు,end_to_end\tem_06359_00054733629.wav
1109,tem_00682_00147929690,తంజావూరు దక్షిణ భారత దేశము నందలి తమిళనాడు రాష్ట్రములోని ఒక పట్టణము,end_to_end\tem_00682_00147929690.wav
1110,tem_09584_01489049719,గుంతలో తేమ ఎప్పుడూ తగినంత ఉండాలి,end_to_end\tem_09584_01489049719.wav
1111,tem_05479_01055015616,ఆళ్వారు అనిన కాపాడువారు అని వ్యుత్పత్తి\n,end_to_end\tem_05479_01055015616.wav
1112,tem_09015_00272299026,ఇదంతా ముందే నిర్ణయించబడింది,end_to_end\tem_09015_00272299026.wav
1113,tem_08680_01889773672,ఆయన కొన్ని పాటలకు సంగీతం కూడా సమకూర్చాడు\n,end_to_end\tem_08680_01889773672.wav
1114,tem_08680_02034047958,ఈనడానికి పదునయిదు నుండి ముప్పై నిమిషములు పడుతుంది\n,end_to_end\tem_08680_02034047958.wav
1115,tem_07220_00763452592,ఈ నవలామాలికలోని నవలలు మొత్తం పన్నెండు,end_to_end\tem_07220_00763452592.wav
1116,tem_09015_00905303996,ఒక్కొక్కరే వారంతా అలసి పోయి తొలగి పోయారు,end_to_end\tem_09015_00905303996.wav
1117,tem_08680_00994510562,సోమవారం గ్రామోత్సవం నిర్వహించినారు\n,end_to_end\tem_08680_00994510562.wav
1118,tem_06917_02028893316,గూడెం అదిలాబాదు జిల్లా బెజ్జూర్‌ మండలానికి చెందిన గ్రామము,end_to_end\tem_06917_02028893316.wav
1119,tem_04272_01980702377,మా ఊరు పేరు జత చెయ్యండి,end_to_end\tem_04272_01980702377.wav
1120,tem_04272_00703840193,ఇది వరకే మీ ఊరు గురించిన వ్యాసం ఉండవచ్చు,end_to_end\tem_04272_00703840193.wav
1121,tem_05425_01829988662,బాపట్ల ఇంజనీరింగ్ కళాశాలలో భాగం కాదు,end_to_end\tem_05425_01829988662.wav
1122,tem_08377_00048628250,ఈ వ్యాసం పశ్చిమ గోదావరి జిల్లాలో ఏలూరు సమీపంలోని గ్రామం గురించి\n,end_to_end\tem_08377_00048628250.wav
1123,tem_06917_00544463935,శ్రీకాకుళం మండలం ఆంధ్ర ప్రదేశ్ రాష్ట్రములోని శ్రీకాకుళం జిల్లాకు చెందిన ఒక మండలము,end_to_end\tem_06917_00544463935.wav
1124,tem_03338_00219762348,స్వర్గం ఇక్కడే వుంటుంది,end_to_end\tem_03338_00219762348.wav
1125,tem_05479_00566501543,దీని వృక్ష శాస్త్రీయ నామం\n,end_to_end\tem_05479_00566501543.wav
1126,tem_00113_01741123074,పిన్ కోడ్ అయిదు లక్షల తొమ్మిది వేల మూడు వందల ముప్పై తొమ్మిది,end_to_end\tem_00113_01741123074.wav
1127,tem_04771_00597594427,అయిదు వందల అడుగుల్లో,end_to_end\tem_04771_00597594427.wav
1128,tem_09015_00728950763,దీనికి ప్రమాణం ఎర్గ్/సెకను,end_to_end\tem_09015_00728950763.wav
1129,tem_09015_01624410900,ఇక అక్కడినుండి అసలు కథ మొదలవుతుంది,end_to_end\tem_09015_01624410900.wav
1130,tem_09015_01673110990,వీటి మాంసమును విక్రయిస్తారు,end_to_end\tem_09015_01673110990.wav
1131,tem_02769_00678461907,తాజా పరిణామాల నేపథ్యంలో,end_to_end\tem_02769_00678461907.wav
1132,tem_07220_00060275211,జిల్లకు బీజపూర్ కేంద్రంగా చేయబడింది,end_to_end\tem_07220_00060275211.wav
1133,tem_06359_00146994317,అంగ వంగ దేశాలనుండి రత్నాలు తెచ్చాడు,end_to_end\tem_06359_00146994317.wav
1134,tem_04771_00502132947,మీ గమ్యస్థానం ఎడమవైపున ఉంది.,end_to_end\tem_04771_00502132947.wav
1135,tem_09015_00138143419,కొందరికి పగటిపూట ఏ ఇబ్బందీ ఉండదు,end_to_end\tem_09015_00138143419.wav
1136,tem_04272_02022451803,ప్రధాన రాజకీయ పార్టీలు కాంగ్రెస్ తెలుగు దేశం తెరాస,end_to_end\tem_04272_02022451803.wav
1137,tem_08680_01104332501,మీ వీక్షణ జాబితాను మార్చడానికి మీరు లాగిన్‌ అయి ఉండాలి\n,end_to_end\tem_08680_01104332501.wav
1138,tem_06582_00459177394,కపిల గోవు దానం చేయాలి,end_to_end\tem_06582_00459177394.wav
1139,tem_05479_01517528010,ఈ సినిమాల జాబితా పెట్టింది నేనే\n,end_to_end\tem_05479_01517528010.wav
1140,tem_00682_01395247164,ఈ పట్టణం హసన్ జిల్లాకు రాజధాని కూడా,end_to_end\tem_00682_01395247164.wav
1141,tem_06917_00382378593,నెల్లూరు జిల్లా కోట మండలం లోని గ్రామం,end_to_end\tem_06917_00382378593.wav
1142,tem_06359_02125756845,కర్పూరం నీటిలో కరగదు,end_to_end\tem_06359_02125756845.wav
1143,tem_05479_00844691508,ధ్వని ప్లాస్మా లో కూడా ప్రయాణించును\n,end_to_end\tem_05479_00844691508.wav
1144,tem_00682_01500932293,తొలి టెస్ట్ లోనే శతకం సాధించిన మొట్టమొదటి బ్యాట్స్‌మెన్ గా కూడా రికార్డు సృష్టించాడు,end_to_end\tem_00682_01500932293.wav
1145,tem_00682_00546682909,మన కంట్లో ఒక కటకం  ఉంటుంది,end_to_end\tem_00682_00546682909.wav
1146,tem_04272_01210058702,శ్రీకాకుళం కృష్ణా జిల్లా ఘంటసాల మండలానికి చెందిన గ్రామము,end_to_end\tem_04272_01210058702.wav
1147,tem_08680_00368866639,ప్రతీ నిర్వాహకుడు వికీపీడియా తొలగింపు విధానం చదివి అర్థం చేసుకోవాలి\n,end_to_end\tem_08680_00368866639.wav
1148,tem_08377_00232160551,ఆచమనం చేసిన తరువాత నోటిని తుడుచుకోవాలి\n,end_to_end\tem_08377_00232160551.wav
1149,tem_04272_01406148140,ఇదే ఆమె యొక్క ఏకైక సెంచరీ,end_to_end\tem_04272_01406148140.wav
1150,tem_09015_00349671511,ఈ గ్రామంలో బెనివాల్స్ అధికంగా ఉన్నారు,end_to_end\tem_09015_00349671511.wav
1151,tem_03338_01223351990,ఇది కళాకారులను ఎంతో ఉత్తేజితులను చేసింది,end_to_end\tem_03338_01223351990.wav
1152,tem_03338_00297471337,అల్లా ఒక్కడే పూజింపబడుటకు సరియైనవాడు,end_to_end\tem_03338_00297471337.wav
1153,tem_09525_00804207866,పిన్ కోడ్ అయిదు వందల ముప్పై నాలుగు వందల అరవై ఆరు,end_to_end\tem_09525_00804207866.wav
1154,tem_08377_01198849117,వారిలో వీర్య సామర్థ్యం తగ్గిపోతోంది\n,end_to_end\tem_08377_01198849117.wav
1155,tem_00682_00143918275,ఆ ప్రక్రియ ఎలా సాగిందో చూద్దాం,end_to_end\tem_00682_00143918275.wav
1156,tem_00682_00911062561,ఇది ముగ్గురు కళాకారులచేత చెప్పబడుతుంది,end_to_end\tem_00682_00911062561.wav
1157,tem_03338_01770199649,మిగిలిన దర్శకత్వ బాధ్యతలను కెఎస్ఆర్,end_to_end\tem_03338_01770199649.wav
1158,tem_00974_01903008631,వాటిలో రెస్టారెంట్ విభాగం కూడా ఉండొచ్చు,end_to_end\tem_00974_01903008631.wav
1159,tem_09222_00284070018,దీని ఇంధన సామర్థ్యము సుమారు ఎనభై రెండు గ్యాలన్లు,end_to_end\tem_09222_00284070018.wav
1160,tem_02812_00299325147,గ్రామ విస్తీర్ణం తొమ్మిది వందల నలభై హెక్టారులు,end_to_end\tem_02812_00299325147.wav
1161,tem_04771_00237641118,దయచేసి సమస్యను వివరించండి,end_to_end\tem_04771_00237641118.wav
1162,tem_00682_01537231382,నారాయణ భట్టు వాఙ్మయదురంధరుడు,end_to_end\tem_00682_01537231382.wav
1163,tem_00682_00193306515,అతిక్రమము చేయువారిలో ఎంచబడినవాడాయెను,end_to_end\tem_00682_00193306515.wav
1164,tem_08680_01023816307,గ్రామ విస్తీర్ణం ఏడు వందల ముప్పై ఏడు హెక్టారులు\n,end_to_end\tem_08680_01023816307.wav
1165,tem_03338_00242891212,అవిక్షత్తు కుమారుడే మరుత్తు,end_to_end\tem_03338_00242891212.wav
1166,tem_09525_00572443397,ఫిరోజ్ సరిగ్గా అరవై సంవత్సరాలు జీవించారూ,end_to_end\tem_09525_00572443397.wav
1167,tem_09584_00545677505,సూర్యగ్రహణముకు సూర్యుని గ్రహించుట,end_to_end\tem_09584_00545677505.wav
1168,tem_09222_01653945627,దానికి ముందు ఒక విభిన్నమైన విధానం ఉండేది\n,end_to_end\tem_09222_01653945627.wav
1169,tem_00682_00484853089,శ్రీకాకుళం జిల్లాలో ఇది ఒక లోక్‌సభ స్థానము,end_to_end\tem_00682_00484853089.wav
1170,tem_05425_01154922764,వరంగల్ జిల్లా కు ముఖ్య పట్టణం వరంగల్,end_to_end\tem_05425_01154922764.wav
1171,tem_09584_01344530762,ఆమెను మానసిక చికిత్సాలయంలో చేర్పించారు,end_to_end\tem_09584_01344530762.wav
1172,tem_00682_00185834466,రక్తము తీయు,end_to_end\tem_00682_00185834466.wav
1173,tem_04272_00010577771,ఇది కాళిదాసు యొక్క మొట్టమొదటి నాటక రచన,end_to_end\tem_04272_00010577771.wav
1174,tem_05425_01442351026,చరిత్రలో మొట్టమొదటి సారిగా భారతదేశపు ప్రస్తావన వచ్చింది ఇక్కడే,end_to_end\tem_05425_01442351026.wav
1175,tem_03338_00929828687,నా పేరు సాక్షి,end_to_end\tem_03338_00929828687.wav
1176,tem_05425_01571122760,ఇంకో విషయం నా పేరే తప్పుగా వ్రాశారు,end_to_end\tem_05425_01571122760.wav
1177,tem_05479_02067865176,వ్యవసాయం కొరకు కృష్ణా నది నుండి ఈ గ్రామము మీదుగా ఒక కాలువ కలదు\n,end_to_end\tem_05479_02067865176.wav
1178,tem_03338_00591945921,ఆమె మొదట హవాయిలో పెరిగింది,end_to_end\tem_03338_00591945921.wav
1179,tem_03338_01677924443,దీని ముందు డిడిటి చేసే హాని చాలా తక్కువ,end_to_end\tem_03338_01677924443.wav
1180,tem_02812_00395498021,ఇట్స్ ఫ్రీ టు బికమ్ ఏ మెంబర్,end_to_end\tem_02812_00395498021.wav
1181,tem_07220_01912321828,మిగిలిన వారు అక్కడే నిలబడ్డారు,end_to_end\tem_07220_01912321828.wav
1182,tem_04272_00951528617,భారత్ లో తపాలా కోడ్ ల విభజన,end_to_end\tem_04272_00951528617.wav
1183,tem_04272_00503091795,కావలి శ్రీకాకుళం జిల్లా సంతకవిటి మండలానికి చెందిన గ్రామము,end_to_end\tem_04272_00503091795.wav
1184,tem_03338_02127978849,ఈ దుంప మార్పు చెందిన కొమ్మ,end_to_end\tem_03338_02127978849.wav
1185,tem_03338_01333230072,వాని మీద మంచి తప్పు మోపినారు,end_to_end\tem_03338_01333230072.wav
1186,tem_07220_01097420881,బిస్మిల్లాఖాన్ సరస్వతీ దేవి భక్తుడు,end_to_end\tem_07220_01097420881.wav
1187,tem_09015_00010795377,వారి పోకడ వేరు,end_to_end\tem_09015_00010795377.wav
1188,tem_06582_01945991188,ది డిఫెన్స్ ఆఫ్ ఇండియా,end_to_end\tem_06582_01945991188.wav
1189,tem_02812_01710187261,కాళ్ళు మెల్లగా వెనుకకు వదలాలి,end_to_end\tem_02812_01710187261.wav
1190,tem_05425_01210540347,ఆయన విద్యాభ్యాసం పూర్తిగా అక్కడే జరిగింది,end_to_end\tem_05425_01210540347.wav
1191,tem_00682_01264324394,ఇంటర్నేషనల్ క్రిమినల్ కోర్ట్,end_to_end\tem_00682_01264324394.wav
1192,tem_05425_01617116172,ఇది తెలుగు సంవత్సరంలో ఐదవ నెల,end_to_end\tem_05425_01617116172.wav
1193,tem_00682_01392442483,కాని మనకు వ్రాసే అలవాటు తక్కువ,end_to_end\tem_00682_01392442483.wav
1194,tem_00682_00025627195,పెళ్ళి దాకా వెళుతుంది,end_to_end\tem_00682_00025627195.wav
1195,tem_08680_01676353383,విశాఖపట్నం ఆంధ్ర ప్రదేశ్ రాష్ట్రములోని విశాఖపట్నం జిల్లాకు చెందిన ఒక మండలము,end_to_end\tem_08680_01676353383.wav
1196,tem_04272_00671813870,కాని ఈ గ్రామానికి ఎటువంటి వసతులు లేవు,end_to_end\tem_04272_00671813870.wav
1197,tem_08680_00954356070,పిన్ కోడ్ అయిదు లక్షల అయిదు వేల నాలుగు వందల అరవై ఏడు,end_to_end\tem_08680_00954356070.wav
1198,tem_06359_01052831817,అర్జునుడు దానిని కూడా విరిచాడు,end_to_end\tem_06359_01052831817.wav
1199,tem_02812_01313978443,ఈ ప్రమాదం జరిగిన కొన్ని నెలల తర్వాత దీన్ని గురించి కొన్ని మూల గ్రంథాలు కూడా రాయడం జరిగింది,end_to_end\tem_02812_01313978443.wav
1200,tem_04272_00511474685,ఇంగ్లీషు వికీపీడియా కూడా అంతకు కొద్ది రోజుల ముందే పరిచయం,end_to_end\tem_04272_00511474685.wav
1201,tem_08680_01286716975,దాసరి నారాయణరావు ప్రభుత్వ మహిళా డిగ్రీ కళాశాల ఉన్నది\n,end_to_end\tem_08680_01286716975.wav
1202,tem_03338_00916710280,దొర గడీ నాశనం చేశారు,end_to_end\tem_03338_00916710280.wav
1203,tem_07220_01308230746,ఇది ఒక తెలుగు సినిమా గురించిన వ్యాసం,end_to_end\tem_07220_01308230746.wav
1204,tem_02812_00729240802,కావున దీనిని తెల్లమద్ది అంటారు,end_to_end\tem_02812_00729240802.wav
1205,tem_04272_01979485375,ఒక నటుడిగా ఆయన పౌరాణిక సాంఘిక చారిత్రక జానపద పాత్రలు చేసాడు,end_to_end\tem_04272_01979485375.wav
1206,tem_00974_02024148281,రాజ్యానికి వారసులు లేక వారు చింతిచేవారు,end_to_end\tem_00974_02024148281.wav
1207,tem_06917_01706613214,అది నిజం పేరు కాకపోయినా సరే వివరాలకు ఇక్కడ చూడండి,end_to_end\tem_06917_01706613214.wav
1208,tem_06885_00268822275,అక్కడ మొదటి సంవత్సరం బిటెక్,end_to_end\tem_06885_00268822275.wav
1209,tem_03338_02004700393,వేరెవ్వరు రారు కూడ,end_to_end\tem_03338_02004700393.wav
1210,tem_00682_01066137633,ఇది ఒక సాంప్రదాయము,end_to_end\tem_00682_01066137633.wav
1211,tem_04771_00136455886,మీరు చేరుకున్నారు.,end_to_end\tem_04771_00136455886.wav
1212,tem_05425_00135768006,నిజం చెప్పాలంటే వికిపీడియా నాకు కొత్త,end_to_end\tem_05425_00135768006.wav
1213,tem_05479_00840516651,వాటి లింకుల కోసం శ్రీకాకుళం అయోమయ నివృత్తి చూడండి\n,end_to_end\tem_05479_00840516651.wav
1214,tem_02812_01071228171,అందులో రెండు నంది అవార్డులు కూడా ఉన్నాయి,end_to_end\tem_02812_01071228171.wav
1215,tem_05425_01631528186,ఇది ఊరిలో గల పురాతన దేవస్థానము,end_to_end\tem_05425_01631528186.wav
1216,tem_08680_02026528985,నేను సోనీ తిరిగి ఏం నా పునరుద్ధరణ కోసం\n,end_to_end\tem_08680_02026528985.wav
1217,tem_00682_00630380706,లక్ష్మీరాజ్యం తెలుగు సినిమా రంగస్థల నటి మరియు నిర్మాత,end_to_end\tem_00682_00630380706.wav
1218,tem_08680_01431185716,అలాంటి అంశాలు మనిషిలోనూ ఉంటాయి\n,end_to_end\tem_08680_01431185716.wav
1219,tem_04272_01876017014,ఇది కేవలం తొలి సమాచారం మాత్రమే,end_to_end\tem_04272_01876017014.wav
1220,tem_04272_01284695123,హిందూ మతం చాళుక్యుల పరిపాలన కాలంలో రాజ్య మతం,end_to_end\tem_04272_01284695123.wav
1221,tem_02769_00604632440,అనంత పద్మనాభుడి ఆలయం అత్యంత పురాతనమైనది,end_to_end\tem_02769_00604632440.wav
1222,tem_02812_01342462826,గొంతుకపోక గొంతునబడి,end_to_end\tem_02812_01342462826.wav
1223,tem_09222_00658018344,మొదట్నుంచీ బెజవాడ రాజరత్నం గాయని,end_to_end\tem_09222_00658018344.wav
1224,tem_09222_00448917915,ఎంబీఏ కూడా అక్కడే చదివాడు,end_to_end\tem_09222_00448917915.wav
1225,tem_07220_01685367985,కాని ఆ ప్రేమను మనసులోనే దాచుకుంటుంది,end_to_end\tem_07220_01685367985.wav
1226,tem_00682_01508141552,ఒక అర్ధణాకు కుంచం నిండా ఉప్పు ఇచ్చేవారు,end_to_end\tem_00682_01508141552.wav
1227,tem_00974_01062944855,ఇందు ప్రఖ్యాతి వహించినది దర్బారుగుహ,end_to_end\tem_00974_01062944855.wav
1228,tem_02812_01996616162,దీని వృక్ష శాస్త్రీయ నామం,end_to_end\tem_02812_01996616162.wav
1229,tem_07486_01629793425,పాంపీ కళ హాలీవుడ్ కళ వంటిది కాదు,end_to_end\tem_07486_01629793425.wav
1230,tem_00974_00118173300,రంగారావు బహుముఖ ప్రజ్ఞాశాలి,end_to_end\tem_00974_00118173300.wav
1231,tem_06359_01582115325,గరుడ బేతరాజు క్రీ,end_to_end\tem_06359_01582115325.wav
1232,tem_09015_00047808479,అతను వంట సామగ్రి వాహనాన్ని నడుపుతాడు,end_to_end\tem_09015_00047808479.wav
1233,tem_04272_00145832465,బజార్‌హథ్నూర్‌ ఆంధ్ర ప్రదేశ్ రాష్ట్రములోని అదిలాబాదు జిల్లాకు చెందిన ఒక మండలము,end_to_end\tem_04272_00145832465.wav
1234,tem_04272_00855563460,రంగారావు గారికి ఇద్దరు కుమారులు ఒక్క కుమార్తె,end_to_end\tem_04272_00855563460.wav
1235,tem_00682_01440888206,నగరం అంతా ఆ రోజు పండుగ వాతావరణంలో ఉంది,end_to_end\tem_00682_01440888206.wav
1236,tem_03338_01697588410,రుక్మాంగద రుబాయిలు అయిదు,end_to_end\tem_03338_01697588410.wav
1237,tem_08680_02112907125,రెండస్తుల భవనాలు పూర్తిగా నీట మునిగాయి\n,end_to_end\tem_08680_02112907125.wav
1238,tem_02812_00837744903,కృష్ణయ్య చేసిన ప్రయత్నం ఫలించలేదు,end_to_end\tem_02812_00837744903.wav
1239,tem_08680_01936427881,ఇప్పటి జిల్లా పరిషత్ అధ్యక్షుడు రామచంద్రా రెడ్డి దీనికి శంఖుస్థాపన చేసినాడు,end_to_end\tem_08680_01936427881.wav
1240,tem_09222_00431192360,వాటిని మీకు చెప్తాను,end_to_end\tem_09222_00431192360.wav
1241,tem_09015_01004903544,ఆ పైన చుట్టూ రెండు చెంచాలు నూనె వెయ్యాలి,end_to_end\tem_09015_01004903544.wav
1242,tem_09015_00577992382,కర్ణుడికి ఏదో అసంతృప్తి,end_to_end\tem_09015_00577992382.wav
1243,tem_03338_00755146676,పిన్ కోడ్ అయిదు లక్షలు తొమ్మిది వేల వందలు అయిదు,end_to_end\tem_03338_00755146676.wav
1244,tem_00682_01878996051,సత్యంబులచేత మిము మెప్పించెదనంటినా,end_to_end\tem_00682_01878996051.wav
1245,tem_00682_00879730759,దానితో వారు అక్కడ దేవాలయం నిర్మించారు,end_to_end\tem_00682_00879730759.wav
1246,tem_09015_02105109658,వారిలో ముఖ్యులు మధు కైటభుడు,end_to_end\tem_09015_02105109658.wav
1247,tem_05479_00680252835,నంద్యాల పట్టణానికి రైలు సౌకర్యం మరియు బస్సు సౌకర్యం రెండూ ఉన్నాయి\n,end_to_end\tem_05479_00680252835.wav
