,filename,transcription,filepath
0,tem_07220_01981175708,దీనిని తటస్థీకరణము అందురు,end_to_end\tem_07220_01981175708.wav
1,tem_06359_01516502961,దీనిని స్కోరుగా అనువదిస్తారు,end_to_end\tem_06359_01516502961.wav
2,tem_02812_01868000938,రెండంతస్తుల భవనాలు పూర్తిగా నీట మునిగాయి,end_to_end\tem_02812_01868000938.wav
3,tem_08680_00300488472,పిన్ కోడ్ అయిదు లక్షలు అయిదు వేలు అయిదు వందలు ముప్పై ఒకటి,end_to_end\tem_08680_00300488472.wav
4,tem_02769_01899577322,ద్రవరూపంలోని మలినాలు తేమ వంటివి,end_to_end\tem_02769_01899577322.wav
5,tem_02812_01823000984,ఆంధ్రప్రదేశ్ రాష్ట్ర మాజీ ముఖ్యమంత్రి నందమూరి తారక రామారావు రెండవ భార్య నందమూరి లక్ష్మీపార్వతి,end_to_end\tem_02812_01823000984.wav
6,tem_04272_00085680040,ఊరిలో గల ముఖ్యమైన దేవాలయాలు వెంకటేశ్వర దేవాలయం మరియూ శివాలయం,end_to_end\tem_04272_00085680040.wav
7,tem_00682_01850053901,ఏమయ్య ఓ సంఘపోల్లు ఎక్కడ చూస్తే ఏమీ లేదు,end_to_end\tem_00682_01850053901.wav
8,tem_02812_01751042579,సావిత్రి కూడా నారదునికి నమస్కరించింది,end_to_end\tem_02812_01751042579.wav
9,tem_02812_00139977145,మేము దాన్ని కెలక్కూడదని ఇలా జరిగిందేమో,end_to_end\tem_02812_00139977145.wav
10,tem_09525_01277785783,మరియు యూరోప్ యాత్ర చేపడతానని చెప్పింది\n,end_to_end\tem_09525_01277785783.wav
11,tem_07220_01099248016,ఇక్కడ బౌద్ధమత సంస్కృతి ఎక్కువగా ఉంది,end_to_end\tem_07220_01099248016.wav
12,tem_07220_00848795094,అంతే కాక ఈ గ్రామంలో రామాలయం కలదు,end_to_end\tem_07220_00848795094.wav
13,tem_05425_00730751448,ఇంకనూ ఏదైనా సందేహం వస్తే ఖచ్చితంగా చర్చా పేజీలో వ్రాయండి,end_to_end\tem_05425_00730751448.wav
14,tem_03338_02137607119,ఇది నమ్మకానికి సంభందించిన సమస్య అంది,end_to_end\tem_03338_02137607119.wav
15,tem_00974_01661176726,అజ్మీర్ పట్టణం జిల్లాకేంద్రంగా ఉంది,end_to_end\tem_00974_01661176726.wav
16,tem_02812_01982547170,మద్రాసు నుండి వెలువడిన పత్రిక,end_to_end\tem_02812_01982547170.wav
17,tem_04272_00428634734,ఈ సినిమాకు మాటలు రాసింది మరో జ్ఞానపీఠ గ్రహీత నారాయణరెడ్డి,end_to_end\tem_04272_00428634734.wav
18,tem_04771_01991432192,పావు మైలులో,end_to_end\tem_04771_01991432192.wav
19,tem_06359_01531983402,పితోర్ ఘర్ నుండి ఇది పది కిలో మీటర్ల దూరం కలదు,end_to_end\tem_06359_01531983402.wav
20,tem_00113_01558669646,అయితే అది సిబ్బంది కొరతను ఎదుర్కొంది,end_to_end\tem_00113_01558669646.wav
21,tem_06359_00517155968,వృషణాలు ఇందుకొ తోడ్పడతాయి,end_to_end\tem_06359_00517155968.wav
22,tem_07220_00483682022,కెసీ మీడియా ప్రధాన ఆకర్షణగా మారారు,end_to_end\tem_07220_00483682022.wav
23,tem_08680_01559756401,అద్బుతం కాకపోయినా ఓకే అనిపిస్తుంది\n,end_to_end\tem_08680_01559756401.wav
24,tem_00974_00280931399,రుచి కూడా వికారం పుట్టిచ్చినట్లుండును,end_to_end\tem_00974_00280931399.wav
25,tem_02769_00296474841,దీంతో ఎవరినీ కలిసేది కాదామె,end_to_end\tem_02769_00296474841.wav
26,tem_07220_00400840482,భారతి మాస సంచిక,end_to_end\tem_07220_00400840482.wav
27,tem_02769_00301408224,నానీ కవితారూపం ఆత్మీయమైంది,end_to_end\tem_02769_00301408224.wav
28,tem_07220_01765851956,అడవిజంతువులతో పాటే సంచరిస్తూ,end_to_end\tem_07220_01765851956.wav
29,tem_05425_01030728048,ఇది కేవలం సారాంశం మాత్రమే పూర్తి పాఠం కోసం లైసెన్సు పాఠం చూడండి,end_to_end\tem_05425_01030728048.wav
30,tem_08377_01929069671,శ్రీ రామ నవమి కథ\n,end_to_end\tem_08377_01929069671.wav
31,tem_02769_01752319773,ఇది నగరానికి పడమటి వైపున ఉంది,end_to_end\tem_02769_01752319773.wav
32,tem_06359_00312043864,సూర్యగ్రహణమునకు సూర్యుని గ్రహించుట,end_to_end\tem_06359_00312043864.wav
33,tem_09222_01106409810,తాను చనిపోయితినా వేశ్యలందును పాలవించెదరు,end_to_end\tem_09222_01106409810.wav
34,tem_09222_00733859292,మధ్యప్రదేశ్ లోని ఒక గ్రామంలో ప్రాథమిక పాఠశాల,end_to_end\tem_09222_00733859292.wav
35,tem_04771_01654641202,నాలుగు వందల అడుగుల్లో,end_to_end\tem_04771_01654641202.wav
36,tem_03338_01483230363,త్రిగర్త దేశాధీసుడు ఉచితముగా చెప్పాడు,end_to_end\tem_03338_01483230363.wav
37,tem_03338_01025904842,శ్యామలను తన ఇంటికి తీసుకెళతాడు,end_to_end\tem_03338_01025904842.wav
38,tem_03338_01470131381,రవితనికెళ్ళ భరణి,end_to_end\tem_03338_01470131381.wav
39,tem_04272_00657356298,మన రాష్ట్రంలో ఇది ఒక్కటే వ్యవసాయ ఇంజనీరింగ్ కళాశాల,end_to_end\tem_04272_00657356298.wav
40,tem_02812_00294653918,అంటే ఏమిటి ఎలా వాడుతారు వాటిలో ప్రత్యేకత కొద్ది ఉదాహరణలు వగైరా,end_to_end\tem_02812_00294653918.wav
41,tem_03338_01941096516,వీటి వయస్సు ముప్పై ఏళ్ళు,end_to_end\tem_03338_01941096516.wav
42,tem_06359_01971913836,వాటిని మీకు చెప్తాను,end_to_end\tem_06359_01971913836.wav
43,tem_04272_01872258983,దీనిని వాడుకలో ఎక్కువగా జైలు అంటారు,end_to_end\tem_04272_01872258983.wav
44,tem_08680_01001425465,విశాఖపట్నం మండలం ఆంధ్ర ప్రదేశ్ రాష్ట్రములోని విశాఖపట్నం జిల్లాకు చెందిన ఒక మండలము\n,end_to_end\tem_08680_01001425465.wav
45,tem_03338_00681547785,గ్రామ విస్తీర్ణం తొమ్మిది వందలు నలభై హెక్టారులు,end_to_end\tem_03338_00681547785.wav
46,tem_02812_00668357133,సీలోనే తరగతినే ప్రథమ స్థానంలో నిలిచారు,end_to_end\tem_02812_00668357133.wav
47,tem_04272_01056506970,అలాగే బొమ్మ లైసెన్సు వివరాలు కూడా తెలుపండి,end_to_end\tem_04272_01056506970.wav
48,tem_08377_00915685977,చిన్నప్పటి నుంచి సంగీతమంటే తనకి ఆసక్తి\n,end_to_end\tem_08377_00915685977.wav
49,tem_09222_00066407673,టెస్టులలో అతని అత్యధిక స్కోరు డెబ్బై మూడు నాటౌట్\n,end_to_end\tem_09222_00066407673.wav
50,tem_05479_00587647738,ఈ గ్రామానికి సరి అయిన రవాణా సౌకర్యాలు లేవు\n,end_to_end\tem_05479_00587647738.wav
51,tem_09525_00669479992,లండన్ వెయ్యి తొమ్మిది వందల అరవై ఒకటి పే,end_to_end\tem_09525_00669479992.wav
52,tem_00682_01800107121,ఆ లక్ష్యంగా రచనా వ్యాసంగాన్ని ఆరంభించారు,end_to_end\tem_00682_01800107121.wav
53,tem_00682_01911958322,సరస్సు మరియు చెరువు తేడా ఏమిటి,end_to_end\tem_00682_01911958322.wav
54,tem_09525_01022436350,హేమవతి జలాశయం రిజర్వాయర్\n,end_to_end\tem_09525_01022436350.wav
55,tem_05479_01360206388,ముందుగా ద్రౌపదికి యోగసమాధి సడలింది\n,end_to_end\tem_05479_01360206388.wav
56,tem_00682_00391156956,అయినా ఏ మాత్రం ప్రతిస్పందన రాలేదు,end_to_end\tem_00682_00391156956.wav
57,tem_07220_01970083157,ధ్వజస్థంభం నీడ ఇళ్ళమీద పడకూడదు,end_to_end\tem_07220_01970083157.wav
58,tem_06359_02095984398,అందులో ఎక్కువమంది ఐర్లండుకు చెందినవారు,end_to_end\tem_06359_02095984398.wav
59,tem_00974_00409700007,చలన చిత్రముల చట్టము,end_to_end\tem_00974_00409700007.wav
60,tem_05425_00692767676,సంస్కృతం హిందూ బౌద్ధ మరియు జైన మతాలకు ప్రధాన భాష,end_to_end\tem_05425_00692767676.wav
61,tem_03338_00187986586,ఇది రెండు వరుసలలో దీపాలను కలిగి ఉంటుంది,end_to_end\tem_03338_00187986586.wav
62,tem_08680_01130710850,నాకు రుచికరంగా వంటలు చేయడం వచ్చు కదా\n,end_to_end\tem_08680_01130710850.wav
63,tem_09015_01138511866,ఆయనకు ఒక సోదరి మరియు ముగ్గురు సోదరులు,end_to_end\tem_09015_01138511866.wav
64,tem_04272_01256402520,పాలకొల్లు పేజీకి వెళ్ళి పైన ఉన్న మార్చు పైన క్లిక్ చేసి సమాచారం చేర్చవచ్చు,end_to_end\tem_04272_01256402520.wav
65,tem_05425_01311719749,ఈరోజు ఈయన మరణ వార్త ఈనాడు లో వచ్చింది,end_to_end\tem_05425_01311719749.wav
66,tem_03338_00343161536,పలు పార్లమెంటరీ కమిటీలలో కూడా పనిచేశాడు,end_to_end\tem_03338_00343161536.wav
67,tem_08680_00321962469,సావిత్రి కూడా నారదునికి నమస్కరించింది\n,end_to_end\tem_08680_00321962469.wav
68,tem_09525_01591815727,వాటి లింకుల కోసం ఏనుగు అయోమయ నివృత్తి చూడండి\n,end_to_end\tem_09525_01591815727.wav
69,tem_00682_01191966987,పంచాయత్ రాజ్ మంత్రిత్వ శాఖ వెబ్‌సైటులో వరంగల్ జిల్లా తాలూకాల వివరాలు,end_to_end\tem_00682_01191966987.wav
70,tem_00974_01149624936,వీటన్నిటి గురించి తరువాత నేర్చుకుందాం,end_to_end\tem_00974_01149624936.wav
71,tem_00682_01394503445,ఆ వ్యాసం పై కృషి చేసిన వారి వివరాలు,end_to_end\tem_00682_01394503445.wav
72,tem_09222_00694270015,పిన్ కోడ్ అయిదు వందల ముప్పై మూడు రెండు వందల అరవై మూడు,end_to_end\tem_09222_00694270015.wav
73,tem_04771_01662532024,వాయువ్యం వైపుగా,end_to_end\tem_04771_01662532024.wav
74,tem_00974_01957484368,పిన్ కోడ్ అయిదు లక్షలు తొమ్మిది వెలు రెండు వందలు రెండు,end_to_end\tem_00974_01957484368.wav
75,tem_08680_00388947726,కావున దీనిని తెల్లమద్ది అంటారు\n,end_to_end\tem_08680_00388947726.wav
76,tem_04272_00124637762,ఊరిలో పరిశ్రమల పరంగా మంచి అభివృద్ది కలదు,end_to_end\tem_04272_00124637762.wav
77,tem_06359_00453049957,ఈ సందర్భంలో ఒక కథ చెప్తాను,end_to_end\tem_06359_00453049957.wav
78,tem_03338_01250167855,అలాంటి సందర్బములొ చేప్పేది ఈ జాతీయము,end_to_end\tem_03338_01250167855.wav
79,tem_07220_01472160283,వీరిలో ప్రసిద్ధుడు ఖారవేలుడు,end_to_end\tem_07220_01472160283.wav
80,tem_05425_00014159320,కన్యాశుల్కం నాటకం గురజాడ అప్పారావు పంతులు రాసిన సాంఘిక నాటకం,end_to_end\tem_05425_00014159320.wav
81,tem_09584_00477354479,అతన్ని తన సహాయకునిగా పెట్టుకున్నారు,end_to_end\tem_09584_00477354479.wav
82,tem_09015_01547518375,పై నుండి సువిశాలమైన ప్రాంతం కనబడుతుంది,end_to_end\tem_09015_01547518375.wav
83,tem_08377_00606030132,రంగుల పట్టిక అయితే పేజీ కూడా అలాగే బాగుంటుంది\n,end_to_end\tem_08377_00606030132.wav
84,tem_02769_00629677581,పర్యాటక ఆకర్షణలలో జాంగ్ జలపాతం ఒకటి,end_to_end\tem_02769_00629677581.wav
85,tem_04771_00583583696,రాంప్‌కు స్వల్పంగా కుడివైపుకు వెళ్ళండి,end_to_end\tem_04771_00583583696.wav
86,tem_04272_01378706052,ఈ గ్రామంలో ఉత్పత్తి చేసిన పళ్ళు కూరగాయలు హైదరాబాదుకు సరఫరా చేస్తారు,end_to_end\tem_04272_01378706052.wav
87,tem_05479_00002904256,ఏమయినా సందేహాలుంటే తప్పక నా చర్చాపేజీలో రాయండి\n,end_to_end\tem_05479_00002904256.wav
88,tem_09222_02083044266,ప్రారంభ రోమన్ సైన్యం,end_to_end\tem_09222_02083044266.wav
89,tem_08680_00619659586,కవిత్వం కూడా రాశారు,end_to_end\tem_08680_00619659586.wav
90,tem_09015_00459612121,తులసి అనే పాప ఒక ఆస్తిపరుని కుమార్తె,end_to_end\tem_09015_00459612121.wav
91,tem_05479_02008461610,ఈయన తల్లితండ్రులు సింగమ మరియు మమనారాయణ\n,end_to_end\tem_05479_02008461610.wav
92,tem_09015_01130549347,బాలవంతి కథలో రాజుకు సంతానం కలగదు,end_to_end\tem_09015_01130549347.wav
93,tem_09222_00453971829,ఇరాన్ పురాతన సంగీతపరికరాలకు పుట్టిల్లు\n,end_to_end\tem_09222_00453971829.wav
94,tem_05479_01443991974,అందువలన ఈ ప్రాంతం కరొండ మండలం అయింది\n,end_to_end\tem_05479_01443991974.wav
95,tem_03338_01987197158,ఈ నిర్ణయం ఇంకా అమలులోకి రాలేదు,end_to_end\tem_03338_01987197158.wav
96,tem_08680_00857310612,వినదగు నెవ్వరు జెప్పిన,end_to_end\tem_08680_00857310612.wav
97,tem_09222_00143696373,ఇదే పేరుతో ఉన్న ఇతర ప్రాంతాల కొరకు వడ్డేపల్లి అయోమయ నివృత్తి చూడండి,end_to_end\tem_09222_00143696373.wav
98,tem_02812_00724719876,నాకు రుచికరంగా వంటలు చేయడం వచ్చు కదా,end_to_end\tem_02812_00724719876.wav
99,tem_08680_00921983494,ఈ ఘటనలు అతన్ని బాగా బాధిస్తాయి\n,end_to_end\tem_08680_00921983494.wav
100,tem_07220_01596808513,నేల సమతలంగా వుండాలి,end_to_end\tem_07220_01596808513.wav
101,tem_09584_00886976974,పిన్ కోడ్ అయిదు లక్షలు ఏడు వేలు మూడు వందలు ఒక,end_to_end\tem_09584_00886976974.wav
102,tem_09015_01103759630,అదిప్పుడు పునరుద్ధరించ బడుతున్నది,end_to_end\tem_09015_01103759630.wav
103,tem_00682_01226756504,మనం వాళ్ళను విడిచి పెట్టి తప్పు చేసాం,end_to_end\tem_00682_01226756504.wav
104,tem_06885_01602510897,ఈ పరిస్థితి తెలుగులోనే కాదు ఇంగ్లీషులో కూడా ఉంది,end_to_end\tem_06885_01602510897.wav
105,tem_00974_00214602362,విజయనగర సామ్రాజ్యం చాలా విశాలంగా ఉండేది,end_to_end\tem_00974_00214602362.wav
106,tem_05479_00809708946,మధ్యధరా ప్రాంతంచే చుట్టి వున్నది\n,end_to_end\tem_05479_00809708946.wav
107,tem_05425_01695255102,కన్నడ కర్ణాటక రాష్ట్ర అధికార భాష,end_to_end\tem_05425_01695255102.wav
108,tem_03338_00957191347,గున పట్టణం జిల్లాకేంద్రంగా ఉంది,end_to_end\tem_03338_00957191347.wav
109,tem_03338_01016186323,పంటలు సరిగా పండవు,end_to_end\tem_03338_01016186323.wav
110,tem_04272_00220587228,విస్తరణ అంటే కేవలం ఆంగ్ల వికీ అనువాదం కాదు,end_to_end\tem_04272_00220587228.wav
111,tem_08680_00260033804,వెలదులార ముదముమీర నలుగిడ రారే బృందంపధ్నాలుగు\n,end_to_end\tem_08680_00260033804.wav
112,tem_00974_01796656293,గీత తన పదవికి రాజీనామా చేస్తుంది,end_to_end\tem_00974_01796656293.wav
113,tem_05479_01671740903,అంతే గాని వారి అసమర్థతను బయట పెట్టరు\n,end_to_end\tem_05479_01671740903.wav
114,tem_02769_01915629255,సాక్షాత్తూ ప్లాటో అన్నాడా మాట,end_to_end\tem_02769_01915629255.wav
115,tem_00974_00059322050,ఆపేరు కాలక్రమంలో మురుడేశ్వర గా మారింది,end_to_end\tem_00974_00059322050.wav
116,tem_09015_02101549671,దారిలో శివుడు తుఫాను తెప్పిస్తాడు,end_to_end\tem_09015_02101549671.wav
117,tem_08680_00723182467,వీటివలనే వ్యాకరణము పుట్టెనని చెప్పుదురు\n,end_to_end\tem_08680_00723182467.wav
118,tem_00974_00646553082,ఆ వార్త విన్న ద్రౌపది వివశురాలవుతుంది,end_to_end\tem_00974_00646553082.wav
119,tem_09222_01967833668,పువ్వులకు సువాసన గలదు,end_to_end\tem_09222_01967833668.wav
120,tem_03338_00453286615,ఇదంతా చూసి విదురుడికి మనసు కలత చెందింది,end_to_end\tem_03338_00453286615.wav
121,tem_00682_01064209001,ఏమిటి ఎందుకు ఎలా అన్న విషయాలకు ప్రాధాన్యత ఇవ్వాలి,end_to_end\tem_00682_01064209001.wav
122,tem_00682_01777869519,గది తలుపు దానికదే మూసుకుంటుంది,end_to_end\tem_00682_01777869519.wav
123,tem_02769_00843676823,ఆ కంపెనీ క్రమంగా అభివృద్ధి చెందింది,end_to_end\tem_02769_00843676823.wav
124,tem_02769_01470972128,ఇఎమ్బిడిలో కోదండరామిరెడ్డి పేజీ,end_to_end\tem_02769_01470972128.wav
125,tem_09015_00662553986,ఆవుది సాత్త్విక స్వభావం,end_to_end\tem_09015_00662553986.wav
126,tem_07220_00701782684,కలికి కోపం వచ్చింది,end_to_end\tem_07220_00701782684.wav
127,tem_06582_00976746616,ప్రముఖ తెలుగు సినీ దర్శకుడు సత్యనారాయణ,end_to_end\tem_06582_00976746616.wav
128,tem_03338_00681341384,కుంతీ దేవి కుమారులతో ఇలా అన్నది,end_to_end\tem_03338_00681341384.wav
129,tem_06885_01088687923,అవన్నీ నాకు తెలుసు,end_to_end\tem_06885_01088687923.wav
130,tem_04272_00740984256,ఈ వూరికి ప్రక్క వూరు జగన్నాధపురంకు మధ్య ఒక కొండమీద నరసింహ స్వామి ఆలయం ఉంది,end_to_end\tem_04272_00740984256.wav
131,tem_09525_00407032736,పిన్ కోడ్ అయిదు లక్షల తొమ్మిది వేల మూడు వందల ముప్పై తొమ్మిది,end_to_end\tem_09525_00407032736.wav
132,tem_03338_00689406376,భళ్ళెం అని ధ్వని నిస్తాయి,end_to_end\tem_03338_00689406376.wav
133,tem_03338_00362309854,నేనెవరో నీకు తెలియజెప్తాను,end_to_end\tem_03338_00362309854.wav
134,tem_02812_01437256439,కడప జిల్లా ఆంధ్రప్రదేశ్ లోని జిల్లా,end_to_end\tem_02812_01437256439.wav
135,tem_06582_01533037633,కనుక అతడిని రక్షించుకోవడం నా కర్తవ్యం,end_to_end\tem_06582_01533037633.wav
136,tem_09015_01044647020,ఫిబ్రవరి పందొమ్మిదినే దాడికి సిద్ధపడ్డారు,end_to_end\tem_09015_01044647020.wav
137,tem_05425_02011761462,కాకినాడ ని రెండవ మద్రాసు అని పిలుస్తారు,end_to_end\tem_05425_02011761462.wav
138,tem_03338_00803101733,దీనికి పెద్దగా స్పందన రాలేదు,end_to_end\tem_03338_00803101733.wav
139,tem_00682_01703726192,దీని సవరణ ఋణాత్మకం,end_to_end\tem_00682_01703726192.wav
140,tem_09584_00020328055,కానీ ఏదీ కలిసి రాలేదు,end_to_end\tem_09584_00020328055.wav
141,tem_03338_00759484786,అంతే గాని వారి అసమర్థతను బయట పెట్టరు,end_to_end\tem_03338_00759484786.wav
142,tem_09015_01539226051,పాటలో పండు ముసలావిడ గొంతు,end_to_end\tem_09015_01539226051.wav
143,tem_02769_01340272492,ఇప్పుడు ప్రధాన హోం సెక్రటరీ,end_to_end\tem_02769_01340272492.wav
144,tem_05479_01879830193,కాళ్ళు మెల్లగా వెనుకకు వదలాలి\n,end_to_end\tem_05479_01879830193.wav
145,tem_05479_00156018398,అతడు కృష్ణుడిని కూడా వదల లేదు,end_to_end\tem_05479_00156018398.wav
146,tem_08680_02055448895,రెండు ప్రాజెక్ట్లు విజయవంతం అయినాయి\n,end_to_end\tem_08680_02055448895.wav
147,tem_09015_00431450673,దాంతో వివాహం ఆగి పోతుంది,end_to_end\tem_09015_00431450673.wav
148,tem_04771_01074131228,డేటా కనెక్షన్‌ను కోల్పోయారు,end_to_end\tem_04771_01074131228.wav
149,tem_03338_02005009393,ఆ పాలల్లో క్యాలరీలు అధికంగా ఉంటాయి,end_to_end\tem_03338_02005009393.wav
150,tem_04272_02069147614,ఇదే పేరుతో ఉన్న ఇతర ప్రాంతాల కొరకు వనపర్తి అయోమయ నివృత్తి చూడండి,end_to_end\tem_04272_02069147614.wav
151,tem_03338_00158786234,ద్రోణునికి ఎదురు నిలిచేవారు లేక పోయారు,end_to_end\tem_03338_00158786234.wav
152,tem_06359_01693758750,ఈ గ్రామం వెయ్యి తొమ్మిది వందలు మూడులో ఏర్పాటయినది,end_to_end\tem_06359_01693758750.wav
153,tem_09015_01888153985,తిరిగి లైట్ హౌస్ పనిచేయడం మొదలైంది,end_to_end\tem_09015_01888153985.wav
154,tem_09222_01502944770,పిన్ కోడ్ అయిదు వందల ముప్పై నాలుగు రెండు వందల నలభై అయిదు,end_to_end\tem_09222_01502944770.wav
